Stopwords Dropped, Feature Selector, Accuracy, Precision, Recall, F1-Measure, Training took(seconds)
True, Most Frequent Words, 0.7868852459016393, 0.717948717948718, 0.9333333333333333, 0.8115942028985509, 2.189233
False, Most Frequent Words, 0.819672131147541, 0.7567567567567568, 0.9333333333333333, 0.835820895522388, 0.961627
True, Doc Frequency Difference, 0.9180327868852459, 0.8787878787878788, 0.9666666666666667, 0.9206349206349207, 2.412335
False, Doc Frequency Difference, 0.9180327868852459, 0.9032258064516129, 0.9333333333333333, 0.9180327868852459, 0.825137
True, Plain Frequency Difference, 0.8688524590163934, 0.7894736842105263, 1.0, 0.8823529411764706, 1.937562
False, Plain Frequency Difference, 0.8688524590163934, 0.8055555555555556, 0.9666666666666667, 0.8787878787878789, 1.124622
True, Mixed Frequency Difference, 0.9180327868852459, 0.9032258064516129, 0.9333333333333333, 0.9180327868852459, 2.834526
False, Mixed Frequency Difference, 0.9508196721311475, 0.9354838709677419, 0.9666666666666667, 0.9508196721311476, 1.525286